<!ELEMENT meteo (mesure+) >
<!ELEMENT mesure (ville+) >
<!ELEMENT ville EMPTY >
<!ATTLIST mesure
                date CDATA #REQUIRED>
<!ATTLIST ville 
                nom CDATA #REQUIRED
                temperature CDATA #REQUIRED>                
